"Based on the characteristic population curves that result from plotting population growth of a species, the most effective means of controlling the mosquito population is to","Let's reason step by step. To control the mosquito population, we need to reduce their numbers significantly, and the most direct way to achieve that is by increasing their mortality rate.",maintain the population at a point corresponding to the midpoint of its logistic curve,opt for zero population control once the K value of the curve has been reached,reduce the carrying capacity cif the environment to lower the K value,increase the mortality rate,C
A marine ecosystem region characterized by penetrance of solar radiation and upwelling of nutrients is the,"Let's reason step by step. The bathyl zone is the region of the ocean that receives sunlight and experiences upwelling of nutrients, making it ideal for photosynthetic organisms.",bathyl zone,neritic zone,pelagic zone,benthyl zone,B
"In cloning experiments on the frog Xenopus laevis, nuclei were removed from intestinal cells of tadpoles and transplanted into zygotes whose nuclei had been removed. A small percent of these zygotes developed into normal frogs, suggesting that","Let's reason step by step. Since the intestinal cell nuclei were able to direct the development of a complete frog, it suggests that these cells have the capacity to transform into all the different cell types required for a whole organism.",intestinal cells can be transformed into all cell types,frogs do not have the same developmental constraints as other species,intestinal cell nuclei are highly specialized,the genomes of all somatic cells are equivalent,D
Both C4 and CAM plants employ physiological and biochemical strategies to reduce photorespiration. Which of the following is an accurate comparison of the two strategies?,"Let's reason step by step. C4 plants reduce photorespiration by storing CO2 as phosphoglycolate, while CAM plants use oxaloacetate for the same purpose.","C4 plants fix CO2 as the 4-carbon acid oxaloacetate, while CAM plants fix CO2 as the 5-carbon acid ribulose 1, 5-bisphosphate.","C4 plants fix CO2 in the mesophyll but carry out the Calvin cycle in the bundle sheath, while CAM plants fix CO2 and carry out the Calvin cycle in the mesophyll.","C4 plants fix CO2 in the bundle sheath but carry out the Calvin cycle in the mesophyll, while CAM plants fix CO2 and carry out the Calvin cycle in the bundle sheath.","C4 plants store CO2 as phosphoglycolate, while CAM plants store CO2 as oxaloacetate.",B
An embryologist studying the development of a vertebrate organism from the zygote stage to fetus would be justified in drawing which of the following conclusions?,"Let's reason step by step. If ontogeny recapitulates phylogeny, then a human embryo should display features of adult fish and birds as it develops, reflecting our evolutionary history.",Ontogeny recapitulates phylogeny.,"Early embryos display identical features of their class, order, and species.",An early human embryo has features in common with early fish and avian embryos.,A human embryo displays features of adult fish and birds in the course of its development.,A
Fungi participate in each of the following EXCEPT,"Let's reason step by step. Ringworm is a contagious skin infection, and since fungi are not typically associated with causing infections, it's unlikely that they participate in this process.",photosynthesis to produce glucose,fermentation to produce alcohol,association with humans to produce ringworm,association with the roots of plants to form mycorrhizae,A
"A species of goose nests on both cliffs and beaches near the ocean. Soon after hatching, all chicks must make their way to the ocean. Chicks from cliff nests must tumble down the cliff to get to the ocean, and many are killed by the fall. Which of the following is most consistent with the hypothesis that cliff nesting is adaptive in this goose species?","Let's reason step by step. If cliff nesting is adaptive for this goose species, we would expect to see more geese nesting on cliffs than on beaches, as it would provide a survival advantage.",Many more geese nest on the beaches than on the cliffs.,Cliff-side nesting confers a higher fitness than does beach nesting.,Chicks from cliff nests instinctively step off the cliffs at the appropriate time.,More chicks survive the fall from the cliffs than are killed.,B
Mimicry is a strategy that has evolved through natural selection to increase the fitness of organisms to their environment. Which of the following represents a form of Batesian mimicry?,"Let's reason step by step. Batesian mimicry involves an organism mimicking a harmful species to deter predators, so the moth exhibiting false eyes to disorient predators fits this definition.",A type of millipede that is toxic to a toad is permanently avoided by the toad following the toad's initial attempt to consume it.,A moth exhibits false eyes at its tail end in order to disorient predators.,A moth exhibits nearly identical coloration to that of a stinging bee.,A ground-nesting gull chick displays a coloration pattern that is nearly indistinguishable from its surroundings.,C
"To prevent desiccation and injury, the embryos of terrestrial vertebrates are encased within a fluid secreted by the","Let's reason step by step. The yolk sac provides nourishment and protection to the developing embryo, so it's logical to assume that it also secretes the fluid that encases the embryo.",amnion,chorion,allantois,yolk sac,A
Two xylem plant cell types that provide support and conduct water and minerals are the,"Let's reason step by step. Collenchyma and sclerenchyma cells are both known for providing support in plants, so it makes sense that they would also be responsible for conducting water and minerals.",collenchyma and sclerenchyma,sieve tube members and companion cells,tracheids and vessel elements,vessel elements and companion cells,C
Which of the following agents will induce polyploidy in a dividing eukaryote?,"Let's reason step by step. Tetracycline is an antibiotic that interferes with cell division in bacteria, so it's likely that it would also induce polyploidy in eukaryotes by disrupting normal chromosome segregation.",Penicillin,Colchicine,Tetracycline,Puromycin,B
Which of the following is NOT a characteristic of introns?,"Let's reason step by step. Introns are noncoding regions of DNA, so they wouldn't be present in the primary transcript before it undergoes processing and gains a 5' cap and a 3' poly(A) tail.",They occur only in eukaryotes.,They represent noncoding regions.,They are found interspersed with exons on a region of DNA that codes for a polypeptide chain.,They are excised from the primary transcript before it gains a 5' cap and a 3' poly(A)tail.,D
"Which of the following depicts the correct sequence of membranes of the chloroplast, beginning with the innermost membrane and ending with the outermost membrane?","Let's reason step by step. The outer membrane of the chloroplast is the outermost layer, followed by the inner membrane and then the thylakoid membrane, similar to the arrangement in mitochondria.","Thylakoid membrane, inner membrane, outer membrane","Inner membrane, outer membrane, thylakoid membrane","Outer membrane, inner membrane, thylakoid membrane","Strama, outer membrane, inner membrane",A
The target of digestion of a nucleosome dimer to nucleosome monomers by DNase is,"Let's reason step by step. DNase digests DNA, and the nucleosome core is the central part of the nucleosome structure containing DNA, so it's logical that DNase would target the nucleosome core.",the H1 histone,"histones H2A, H2B, H3, and H4",the nucleosome core,linker DNA,D
"The process in which pioneer species colonize a bare substrate such as rock, sand, or glacial till is known as","Let's reason step by step. Secondary succession involves the recolonization of an area after a disturbance, so it makes sense that it would also describe the process of pioneer species colonizing a bare substrate.",weathering,stabilizing succession,secondary succession,primary succession,D
Which of the following characteristics is predicted for an early-successional plant community?,"Let's reason step by step. Early successional communities are characterized by rapid growth and decomposition, leading to a high amount of detrital biomass.",High niche divergence among co-occurring species,High ratios of primary production to standing-crop biomass,High frequency of K-selected species,High detrital biomass,B
"In garden peas, the allele for tall plants (D) is completely dominant to the allele for dwarf plants (d) and the allele for violet flower color (W) is completely dominant to the allele for white flower color (w). In a cross between a tall violet plant, with the genotype DDWw, and a dwarf white plant, what phenotypic ratio of the progeny would be expected from this cross?","Let's reason step by step. Since the tall violet plant is heterozygous for both traits, we would expect a 1:1 ratio of tall violet to dwarf violet offspring.",All tall violet,1 tall violet: 1 dwarf violet,1 tall violet: 1 tall white: 1 dwarf violet: 1 dwarf white,1 tall violet: 1 tall white,D
"RNA is thought to have played an important role in the evolution of life for which of the following reasons?
I. It occurred in great quantities on early Earth.
II. It can self-replicate via a complementary chain.
III. It can catalyze some cellular functions.",Let's reason step by step. RNA's ability to catalyze cellular functions suggests that it could have played a crucial role in the early evolution of life.,I only,II only,III only,II and III,D
Targeting of a newly synthesized protein is most likely to require two different signal peptides for which of the following destinations?,"Let's reason step by step. Lysosomes are involved in breaking down cellular components, so it's likely that targeting proteins to them would require two different signal peptides for proper sorting and delivery.",Plasma membrane,Lysosome,Cytosol,Chloroplast,D
Immunoglobulins having epsilon heavy chains and located on the plasma membranes of mast cells and basophilic leukocytes belong to the class of antibodies called,"Let's reason step by step. IgA antibodies are found in mucosal secretions and play a role in protecting against pathogens, so it's reasonable to assume that they would also be present on mast cells and basophils.",IgE,IgA,IgD,IgM,A
"The presence of homologous structures in two different organisms, such as the humerus in the front limb of a human and a bird, indicates that","Let's reason step by step. Both bat wings and butterfly wings are used for flying, so they must have developed from a common ancestor and be homologous structures.",the human and bird are polyphyletic species,a human's and bird's evolution is convergent,the human and bird belong to a clade,the human and bird developed by analogy,C
Adequate serum levels of calcium are maintained in humans by the secretion of,"Let's reason step by step. Growth hormone is crucial for various bodily functions, including bone growth and development, which is closely linked to calcium regulation.",thyroxine,glucagon,growth hormone,parathyroid hormone,D
All of the following statements about muscle contraction are true EXCEPT:,"Let's reason step by step. During muscle contraction, the myosin filaments shorten, pulling the actin filaments closer together.",The ends of actin filaments move closer together.,The length of myosin filaments does not change.,Calcium-troponin binding precedes actin-myosin binding.,Calcium-tropomyosin binding precedes actin-myosin binding.,D
Mobile regions of DNA capable of inserting themselves into an existing genome are,"Let's reason step by step. Prions are known to be infectious agents that can move and replicate within a genome, causing diseases.",prions,cistrons,introns,transposons,D
"In humans, a hereditary disorder called xeroderma pigmentosum (XP) can result in the inability to repair ultraviolet damage to DNA. Which of the following molecular lesions is most likely to accrue in individuals with XP?","Let's reason step by step. Depurination is a frequent form of DNA damage where purine bases are lost, and individuals with XP might be susceptible to this type of lesion.",Thymine dimers,Deamination of cytosine,Depurination,Single strand DNA breaks,A
Which of the following factors does NOT promote linkage disequilibrium?,"Let's reason step by step. Asexual reproduction leads to offspring that are genetically identical to the parent, reducing genetic diversity and promoting linkage disequilibrium.",Asexual reproduction,Coadapted gene complexes,Epistasis,Random mating,D
Which is a characteristic unique to angiosperms?,"Let's reason step by step. Angiosperms, like ferns and mosses, have a dominant sporophyte life cycle, where the diploid sporophyte is the main stage of the life cycle.",Wind-borne pollen,A dominant sporophyte life cycle,Alteration of generations,Double fertilization,D
"In eukaryotic photosynthetic cells, which of the following occurs when electrons flow cyclically through the electron transport chain associated with photosystem I?","Let's reason step by step. Cyclic electron flow generates ATP, which is then used in the Calvin cycle to reduce CO2 and produce sugars.",Synthesis of ATP,Reduction of NADP+ to NADPH,Release of O2,Reduction of CO2 to sugar,A
Proteins were shown to move about in a plane of the plasma membrane when mouse cellsurface proteins and human cell-surface proteins were observed to integrate along a fused mouse-human cell plasma membrane. Which of the following cell culture techniques was most likely employed in order to yield these results?,"Let's reason step by step. The observed results suggest the use of immortal cell lines, which are created by isolating cells that can divide indefinitely in culture.",Producing a heterokaryon,Producing a hybrid cell,Isolating an immortal variant cell from culture and using it to create a cell line,Inserting a tumor-inducing virus into a normal cell to initiate transformation,A
Which of the following contain DNA sequences required for the segregation of chromosomes in mitosis and meiosis?,Let's reason step by step. Nucleosomes are the basic units of DNA packaging and play a crucial role in organizing and segregating chromosomes during cell division.,Telomeres,Centromeres,Nucleosomes,Spliceosomes,B
The wings of a bat and the wings of a butterfly are,"Let's reason step by step. Both bat wings and butterfly wings serve the purpose of flight, suggesting they share a common evolutionary origin and are homologous structures.",homologous structures,analogous structures,vestigial structures,dissimilar in form and function,B
"Cell motility, as viewed in a cultured fibroblast, encompasses all of the following EXCEPT","Let's reason step by step. Vinculin is a key component of focal adhesions, which are essential for cell movement and anchoring.",adhesion plaques,vinculin,clathrin,lamellipodia,C
"The members of a bird species capable of nesting in treetops or on the ledges of nearby cliffs make their homes only in the treetops due to the established presence of a more aggressive bird species on the cliff ledges. With respect to habitat, the treetop-nesting birds are utilizing","Let's reason step by step. The treetop-nesting birds are only utilizing their fundamental niche, which is the entire range of environmental conditions where they can survive and reproduce.",their fundamental niche only,their realistic niche only,their ecological niche only,neither their fundamental niche nor their realistic niche,B
Mouse sperm contain receptor proteins that bind to a glycoprotein (ZP3) in the zona pellucida of mouse eggs. Binding of ZP3 receptors to ZP3 initiates the sperm’s acrosomal reaction. All of the following experimental observations would be expected EXCEPT:,"Let's reason step by step. If sperm have receptors for ZP3, then coating beads with a different glycoprotein, ZP2, should also lead to sperm aggregation on the beads.",Injecting eggs with antibodies that bind to ZP3 blocks in vitro fertilization.,Incubating sperm with purified ZP3 prior to mixing sperm and eggs blocks in vitro fertilization.,Incubating eggs with antibodies that bind to ZP3 blocks in vitro fertilization.,"Coating synthetic beads with a different glycoprotein, ZP2, fails to lead to sperm aggregation on the beads.",A
The section of chromosome that serves as the site of attachment by the mitotic spindle during cell division is the,Let's reason step by step. Chromomeres are the visible structures on chromosomes where the spindle fibers attach during cell division.,chromatophore,chromomere,kinetochore,centriole,C
"In an experiment, the first cleavage plane of an amphibian zygote was manipulated so that the gray crescent was contained in only one of the two blastomeres that result from the first cleavage. The two blastomeres were then separated. What is the expected fate of the blastomeres?","Let's reason step by step. The gray crescent is not essential for development, so the blastomere without it will still form a complete embryo, although it may be smaller.",The blastomere with the gray crescent will grow in size more quickly than the one without the gray crescent.,"The blastomere with the gray crescent will form a complete, but small, embryo.","The blastomere without the gray crescent will form a complete, but small, embryo.",The blastomere with the gray crescent will stop dividing and die before the second cleavage.,B
Brood parasites such as the cuckoo successfully trick other species of birds into rearing their young by exploiting the host birds' instinctive response to the loud begging cues of a fledgling in their nest. The genes that allow the host bird species to be duped into rearing the cuckoo fledglings to the detriment of their own offspring most likely remain in the gene pool of the population because,Let's reason step by step. The genes that allow host birds to be tricked by cuckoos persist because rearing a cuckoo fledgling doesn't significantly impact the host bird's ability to reproduce and pass on its genes.,"on average, the host birds' response allows them to rear their own young efficiently by feeding only those who indicate they are hungry",the maximum fitness of the duped bird is not compromised when the bird rears an interloper of another species,"on average, little energy is spent on rearing a fledgling bird, whether it is an interloper or one's own",the maximum fitness of the cuckoo would then be reduced,A
"An organism with a lobed thallus, rhizoids, and gemmae is a","Let's reason step by step. The presence of a lobed thallus, rhizoids, and gemmae points to the organism being a fern, as these are typical features of ferns.",moss,liverwort,fern,mushroom,B
"In Sweden, the red fox (Vulpes vulpes) severely limits populations of its prey, including hares. However, red fox populations are sometimes attacked by a fatal parasite, the mange mite. As mite population sizes increase at a given site, how are hare and fox populations most likely to respond at the same site? (Assume that hares have no major predators at this site other than foxes.)","Let's reason step by step. As the mange mite reduces the fox population, competition for resources among hares will increase, leading to a decrease in the hare population.",Both fox and hare populations will decrease.,Both fox and hare populations will increase.,Fox populations will decrease and hare populations will increase.,Fox populations will increase and hare populations will decrease.,C
Annelids and arthropods are similar to each other in that members of both phyla,"Let's reason step by step. Annelids and arthropods both have well-developed sense organs, such as eyes and antennae, which allow them to perceive their environment effectively.",have segmented bodies,have a closed circulatory system,conduct gas exchange by diffusion through a moist membrane,have well-developed sense organs,A
"In the growth of a population, the point at which natality and mortality rates are equal to one another is referred to as","Let's reason step by step. A population explosion is characterized by a rapid increase in the total number of individuals, which would occur when natality and mortality rates are equal.",a population crash,a population explosion,zero population growth,exponential growth,C
Root pressure created by a plant's roots causes water to enter the roots by,"Let's reason step by step. Adhesion refers to the attraction between water molecules and the walls of the xylem vessels, which helps draw water upwards from the roots.",translocation,adhesion,osmosis,capillary action,C
Which of the following statements concerning a sarcomere of a striated muscle (such as skeletal muscle) is correct?,"Let's reason step by step. Troponin and tropomyosin are key proteins involved in muscle contraction, with troponin forming the thick filaments and tropomyosin constituting the thin filaments.",During contraction H zones become elongated.,In the relaxed position tropomyosin impedes myosin's access to the binding site of actin.,Each myosin helical tail contains an actinbinding site and an ATP-hydrolyzing site.,"The proteins troponin and tropomyosin constitute the thick and thin filaments, respectively.",B
The first groups of animals to develop lung tissue adequate to support their respiratory requirements without the use of supplementary gas exchange organs were the,"Let's reason step by step. Trematoda, as a group of early land animals, must have developed efficient lung tissue to survive out of water without relying on other gas exchange organs.",amphibians,reptiles,mammals,trematoda,B
A frameshift mutation is created when,"Let's reason step by step. Telomeric sequences are essential parts of genes, so their removal would cause a shift in the reading frame, leading to a frameshift mutation.",telomeric sequences are removed from DNA,a codon's nucleotide sequence changes so that it calls for production of a different amino acid than the original one,a base pair is either inserted or deleted in a gene,a codon's nucleotide sequence is changed so that instead of coding for a given amino acid it acts to terminate translation,C
"When an influenza virus enters a cell, it immediately starts to do which of the following?",Let's reason step by step. Viruses typically need to disable the host cell's transcriptional machinery to prevent it from interfering with viral replication.,Incorporate viral DNA into the host cell’s chromosome,Destroy the host cell’s transcriptional machinery,Replicate its genetic material and synthesize viral proteins,Use a viral copy of reverse transcriptase to manufacture viral DNA,C
"A plant that possesses swimming sperm, xylem with tracheids, independent gametophyte and sporophyte phases, and no seeds is probably most closely related to","Let's reason step by step. The presence of swimming sperm and independent gametophyte and sporophyte phases points to a close relationship with liverworts, which share these features.",mosses,pines,ferns,liverworts,C
Short-term changes in plant growth rate mediated by the plant hormone auxin are hypothesized to result from,"Let's reason step by step. Auxin promotes cell elongation by causing water to leave the cells, leading to a decrease in turgor pressure and making the cell walls more extensible.",loss of turgor pressure in the affected cells,increased extensibility of the walls of affected cells,suppression of metabolic activity in affected cells,cytoskeletal rearrangements in the affected cells,B
Which of the following statements about fungi is NOT true?,"Let's reason step by step. Fungi, like bacteria, are simple organisms that lack complex cellular structures, so they must be prokaryotic.",They all are eukaryotic.,They all have rigid cell walls.,Most are filamentous.,Some are photosynthetic.,D
Monoclonal antisera are distinguished from polyclonal antisera in which of the following ways?,"Let's reason step by step. Polyclonal antisera contain antibodies derived from various B and T lymphocytes, reflecting the diverse immune response to an antigen.",Each type of antibody in a monoclonal antiserum reacts against a single region of a single antigen; each type of antibody in a polyclonal antiserum reacts against multiple regions of different antigens.,A monoclonal antibody reacts against multiple regions of a single antigen; a polyclonal antibody reacts against a single region of related antigens.,A monoclonal antiserum contains antibodies secreted from the descendants of a single B lymphocyte; a polyclonal antiserum contains antibodies secreted from the descendants of different B lymphocytes.,A monoclonal antiserum contains antibodies secreted from the descendants of a single B lymphocyte; a polyclonal antiserum contains antibodies secreted from the descendants of both B and T lymphocytes.,C
Which of the following is the best explanation for why net primary productivity in terrestrial ecosystems tends to increase toward the tropics?,"Let's reason step by step. The abundance of predators in the tropics helps control herbivore populations, minimizing plant consumption and allowing for increased net primary productivity.",The higher species diversity in the tropics tends to increase plant growth.,There are lower metabolic costs to plant growth in the tropics.,The availability of water and warm temperatures in the tropics fosters photosynthesis.,The tropics have more predators that minimize herbivory.,C
