Which of the following is NOT a correct statement concerning elastin?,"Let's reason step by step. Elastin, a key component of blood vessels, must have a globular structure to provide the necessary flexibility and elasticity for blood flow.",It is a component of large blood vessels.,Its secondary structure consists primarily of alpha helices.,It is secreted into the extracellular matrix of tissues.,It is a globular protein found in connective tissue.,D
Which of the following is a biological attribute that would most likely allow a species to become cosmopolitan in distribution?,"Let's reason step by step. A cosmopolitan species is one that thrives in a very particular and specialized habitat, requiring extreme adaptations to survive.",Extreme habitat specialization,K-selected reproductive rate,Limited dispersal abilities,Capacity for long-distance dispersal,D
The polytene chromosomes seen in Drosophila silvarentis with the aid of a light microscope are,"Let's reason step by step. Polytene chromosomes, with their tightly packed structure, are likely inactive in transcription as the DNA is not easily accessible to the transcriptional machinery.",not actively carrying out transcription,produced only during mitosis,produced by repeated rounds of DNA replication followed by nuclear division,multiple copies of a single chromosome,D
A subunit of DNA and protein consisting of 134-base-pair long stretches of DNA surrounding a protein octomer is called (a),"Let's reason step by step. A histone is a subunit of DNA and protein, consisting of 134-base-pair long stretches of DNA wrapped around a protein octomer.",histone,chromatin,nucleosome,solenoid,C
"A species of small rodent eats seeds from only one species of pine. In normal years, a pair of these rodents will have a litter of two or three. It is unusual for small rodents to have such small litter sizes. The rodents are most likely to exhibit which other characteristic?","Let's reason step by step.  Small litter sizes suggest that the young are precocial, meaning they are born relatively mature and require minimal parental investment.",Moderate sexual size dimorphism,High parental investment,Precocial young,Frequent extrapair matings,B
Aggressive ants live in the swollen thorns of a small tropical tree and feed on oil-rich bodies that the tree produces at the tips of its leaflets. Which of the following experiments best tests the hypothesis that ants defend the plant by either killing or chasing away leaf-feeding insects?,Let's reason step by step. Removing leaf-feeding insects would likely cause a decrease in ant density as the ants would have less prey available.,Remove ants and measure subsequent leaf damage.,Remove oil-rich bodies and measure subsequent ant density.,Remove the thorns and measure subsequent density of ants.,Remove leaf-feeding insects and measure subsequent ant density.,A
Cleavage symmetry arising from early cell divisions that occur at an oblique angle to the polar axis is known as,"Let's reason step by step. Spiral cleavage, with its oblique cell divisions, leads to a radial arrangement of cells around the polar axis, creating a symmetrical pattern.",meroblastic cleavage,radial cleavage,spiral cleavage,superficial cleavage,C
All of the following environmental conditions increase the rate of transpiration from plants EXCEPT,"Let's reason step by step. Wind increases the rate of transpiration by constantly removing water vapor from the vicinity of leaves, creating a steeper concentration gradient and promoting further evaporation.",high temperature,high relative humidity,low relative humidity,wind,B
All of the following might be found in connective tissue EXCEPT,"Let's reason step by step. Fibroblasts, as a type of blood cell, are commonly found in connective tissue where they contribute to tissue repair and regeneration.",thrombin,glycosaminoglycans,collagens,fibroblasts,A
Which of the following is typically NOT found in normal somatic cells of a human male?,"Let's reason step by step. Somatic cells are the cells that compose the body of a multicellular organism and are different from the gametes. So they should also be haploid, meaning that they have half the number of chromosomes as the original zygote.",The entire genetic information possessed by the original zygote,An inactivated X chromosome,Forty-four autosomes,A diploid nucleus,B
Which of the following represents an accurate statement concerning arthropods?,Let's reason step by step. Arthropods are not as widespread as vertebrates and have not been able to adapt to as many different types of environments. So they are not considered as a very successful phylum.,They possess an exoskeleton composed primarily of peptidoglycan.,They possess an open circulatory system with a dorsal heart.,They are members of a biologically unsuccessful phylum incapable of exploiting diverse habitats and nutrition sources.,"They lack paired, jointed appendages.",B
Cellular uptake of cholesterol occurs through internalization of low density lipoproteincholesterol complexes. Cholesterol uptake involves all of the following EXCEPT,Let's reason step by step. Endocytosis is the process by which cells absorb molecules such as proteins by engulfing them. It requires specific cell-surface receptors that bind to the molecule to be internalized.,cell-surface receptors,adhesion plaques,endosome formation,receptor-mediated endocytosis,B
"Which of the following facts was established prior to 1859, the year in which Charles Darwin published On the Origin of Species?","Let's reason step by step. We know that Gregor Mendel published his work on the laws of inheritance in the 19th century, which established the principles of dominant and recessive traits. This happened before Darwin published his work on the origin of species.",DNA provides the macromolecular basis of heredity.,Mendelian principles explain why some traits are dominant and others are recessive.,"Prokaryotes include two major domains, the Bacteria and the Archaea.",There exist fossilized remains of species that have become extinct.,D
Natural enemies have been implicated as a strong selective force for all of the following EXCEPT,"Let's reason step by step. Chemical defenses, such as the production of toxins or repellents, are used by some species to attract potential mates. This is a way to signal their fitness and genetic quality.",aposematic coloration,chemical defenses,masting (synchronous fruiting),lekking behavior,D
"From an evolutionary perspective, the optimality theory as applied to a given trait is best represented by the idea that","Let's reason step by step. The optimality theory states that natural selection will favor traits that provide the greatest benefit to an organism, even if they come at a cost. This is because the benefits of the trait will always outweigh the costs.","if the benefits gained from the trait exceed the cost of the trait to the animal performing them, that trait will persist in the genome","if the trait reaps the best return for the cost relative to alternative forms of the trait, that trait will win out over the alternative forms","beneficial traits are always worth the cost to the organism in energy and physiology, so those traits will persist in the genome",the relative fitness of an organism must be improved due to a specific trait in order for the trait to remain in a population's gene pool,B
Keystone species are thought to have profound effects on the structure and composition of ecological communities because they,Let's reason step by step. Keystone species are those that have a disproportionately large impact on their ecosystem relative to their abundance. This means that they are typically the most abundant species in their communities.,tend to reduce diversity by eliminating food resources for other species,provide the foundation for food webs,are more abundant than most other species in their communities,can prevent superior competitors from driving inferior competitors to local extinction,D
Which of the following sets of reactions occurs in the stroma of the chloroplast in plant cells?,"Let's reason step by step. The stroma of the chloroplast is the fluid-filled inner space of the organelle where many important metabolic reactions take place, such as the Krebs cycle and the decarboxylation of pyruvate.",Calvin cycle,Krebs cycle,Fermentation,Decarboxylation,A
"In one taxonomic classification, Archaea, Eukarya, and Bacteria represent the three major domains of life. Eukarya utilize the general transcription factors TBP (TATA-binding protein) and TFIIB in transcription, whereas Bacteria do not. At least one member of Archaea has a protein similar to TBP and a protein similar to TFIIB. Based on this observation, which of the following scenarios is most likely?","Let's reason step by step. Since Archaea share more similarities with Eukarya than with Bacteria, it is likely that they diverged from a common ancestor after Bacteria diverged from this ancestor.",Archaea and Eukarya diverged after their common ancestor diverged from Bacteria.,Archaea and Bacteria diverged after their common ancestor diverged from Eukarya.,Bacteria and Eukarya diverged after their common ancestor diverged from Archaea.,"Archaea, Eukarya, and Bacteria diverged simultaneously from a common ancestor.",A
The first point of entry of water at the roots of a monocot plant is through the cytoplasm of cells of the,Let's reason step by step. The root cap is the protective covering at the tip of a plant root and is the first point of contact with the soil. So it is the first point of entry of water at the roots.,root cap,Casparian strip,pericycle,endoderm,D
Mutation of homeotic cluster genes often results in which of the following developmental defects in Drosophila?,Let's reason step by step. Homeotic genes are responsible for the identity of body segments during development. So a mutation in these genes would result in the absence of a group of contiguous segments.,Absence of a group of contiguous segments,Transformation of one segment into another,Polarity defects in every segment along the anterior-posterior axis,Tumor formation in imaginal discs,B
Which of the following is true of organisms belonging to the kingdom Protista?,"Let's reason step by step. The kingdom Protista includes a wide variety of eukaryotic organisms, including algae, protozoa, and slime molds. It also includes the cyanobacteria, which are photosynthetic bacteria.",They are eukaryotic.,They include the cyanobacteria.,They are heterotrophic.,They possess cell walls composed of peptidoglycan.,A
Which of the following is the most direct cause of polyteny in somatic cells of certain organisms?,"Let's reason step by step. Polyteny is the condition in which chromosomes undergo repeated rounds of replication without separation, resulting in giant chromosomes. This is caused by chromosome recombination during meiosis.",RNA transcription,Supercoiling of chromatin,Chromosome replication without cell division,Chromosome recombination,C
The structures that act as sites of gas exchange in a woody stem are the,Let's reason step by step. Lenticels are small openings in the bark of woody stems that allow for gas exchange between the plant and the environment. These openings are found in the internode regions of the stem.,lenticels,terminal buds,nodes,internodes,A
Which of the following plant cells undergoes programmed cell death to become functional?,"Let's reason step by step. Phloem sieve tube members are specialized cells that are responsible for the transport of sugars and other organic compounds throughout the plant. To allow for efficient transport, these cells undergo programmed cell death and lose their nuclei and other organelles.",Phloem sieve tube member,Xylem vessel member,Stomatal guard cell,Root cap cell,B
"The sight organs of crustaceans and insects contain ommatidia, which make up the individual visual units of the","Let's reason step by step. Ommatidia are the individual visual units of a simple eye, each containing a lens, a cornea, and a retina. They are responsible for detecting light and transmitting visual information to the brain.",eyespot,simple eye,compound eye,binocular eye,C
Which of the following would be the most dependable environmental signal that a plant in a temperate ecosystem could use to initiate flowering at the correct time of the year?,"Let's reason step by step. The circadian rhythm is an internal biological clock that regulates various physiological processes, including flowering in plants. It is influenced by environmental signals such as light and temperature.",Circadian rhythm,Photoperiod,Changing air temperature,Fluctuations in abscisic acid levels,B
Adaptations of plants to minimize water loss in environments with high temperatures include which of the following?,Let's reason step by step. A large surface-to-volume ratio means that there is more surface area exposed to the environment relative to the volume of the organism. This is beneficial for minimizing water loss because it allows for more efficient transpiration.,Numerous stomata,Thin cuticles,Spines instead of leaves,Large surface-to-volume ratios,C
Which of the following statements is true of air as compared to water?,"Let's reason step by step. Thermal inertia refers to the resistance of a substance to changes in temperature. Since air is less dense than water, it has more thermal inertia and is more resistant to changes in temperature.",Air provides more physical support.,Air has a higher O2 concentration.,Air offers more resistance to motion.,Air has more thermal inertia.,B
"In fungi, cell walls are reinforced by which of the following?","Let's reason step by step. The cell walls of fungi are composed of a variety of polysaccharides, including chitin and glucans. They are also reinforced by silica, which provides structural support and protection.",Chitin,Silica,Lignin,Collagen fibers,A
Ferns undergo alternation of generations in which a,"Let's reason step by step. In flowering plants, the dominant stage is the gametophyte, which produces the gametes, while the sporophyte is dependent on it for nutrients and survival.",dominant sporophyte alternates with an independent gametophyte,dominant gametophyte alternates with a dependent sporophyte,sporophyte and a gametophyte have equal life spans,gametophyte produces gametes by meiosis,A
Many marine birds drink seawater yet maintain their internal osmolarity at a constant level that is hypoosmotic to seawater. Which of the following physiological strategies best explains how the birds maintain their tissue osmolarity?,"Let's reason step by step. Marine birds need to get rid of excess salt, so they must have specialized glands that absorb water from the environment to dilute the salt and excrete it as dilute urine.",Marine birds absorb water from the environment through specialized salt-exchange glands and produce large volumes of dilute urine in the kidneys.,Marine birds absorb salts from the environment through specialized salt-exchange glands and produce large volumes of concentrated urine in the kidneys.,Marine birds excrete salts through specialized salt-exchange glands and excrete small volumes of urine.,Marine birds excrete salts and nitrogenous wastes through specialized nasal glands.,C
Evidence that sea urchins are more closely related to frogs than they are to snails is that echinoderms and chordates share which of the following embryological features?,"Let's reason step by step. Both sea urchins and frogs undergo metamorphosis during their development, which is a significant change in body form from larva to adult.",An embryonic notochord disappears by the adult stage.,Larvae undergo metamorphosis.,Early embryos are unable to compensate for missing cells.,The pore that forms the mouth develops after the pore that forms the anus.,D
"According to the pressure-flow model of movement of phloem contents, photosynthate movement from source to sink is driven by","Let's reason step by step. Photosynthates move through the phloem by diffusing through the cell walls and intercellular spaces, driven by a concentration gradient from source to sink.",an ATP-dependent pressure-flow pump,a water-pressure potential gradient,transpiration,apoplastic diffusion,B
Which of the following statements concerning the Golgi apparatus of a eukaryote is correct?,"Let's reason step by step. The Golgi apparatus is involved in packaging and modifying proteins, so it makes sense that small secretory vesicles would be located near its cis face to transport these modified proteins to their destinations.",It is oriented in the cytoplasm so that its cis face is closest to the endoplasmic reticulum.,It is typically associated with small secretory vesicles located near its cis face.,Its composite flattened cisternae are continuous with one another.,Glycosylation of certain secretory proteins occurs prior to the protein's entry into its lumen.,A
Which of the following traits do prokaryotes and eukaryotes have in common?,"Let's reason step by step. Prokaryotes have a single, circular chromosome that contains their entire genome, and this is a fundamental characteristic shared by all living organisms, including eukaryotes.",A single chromosome carries the entire genome.,Chromosomes are circular.,Replication is bidirectional.,Molecular weight of respective DNA is comparable.,C
All of the following are required procedures in order to clone specific mRNA molecules EXCEPT,"Let's reason step by step. To clone specific mRNA molecules, we need to break down the entire genome into smaller fragments to identify the specific sequences that correspond to the desired mRNA.",extracting mRNA from cells,cleaving the full genome of a cell into fragments,creating a cDNA molecule,converting single-stranded cDNA into double-stranded cDNA,B
An organism belonging to the nekton is which one of the following?,"Let's reason step by step. Nekton refers to organisms that live attached to surfaces in aquatic environments, such as rocks or the hulls of ships, so barnacles would be a fitting example.",Whale,Barnacle,Cyanobacterium,Protist,A
"One hypothesis posed by evolutionary biologists to account for an organism's altruistic behavior in social groups is that of kin selection. According to the kin selection theory, the risk incurred by a bird that sounds an alarm call due to a nearby predator may be offset by the fact that","Let's reason step by step. The bird's alarm call might put it at risk, but it benefits the bird in the long run because other members of the flock will also sound alarms in the future, providing early warning for the bird.",the alarm call induces the predator to abandon its hunt,the alarm call allows the bird to gain protection at the center of a flock,the alarm call will benefit those members with whom the bird shares a percentage of its genes,the bird will gain the same early warning advantage from another member of the flock at a future time,C
Charles Darwin's proposed conditions for natural selection encompass all of the following with regard to a given population EXCEPT,"Let's reason step by step. Natural selection is driven by competition for limited resources, where individuals with traits that allow them to better exploit these resources are more likely to survive and reproduce.","inheritance of both ""fit"" and ""unfit"" genes",differential survival and reproductive success,competition for limited resources,overproduction of offspring,A
Which of the following statements about excretory organs is true?,"Let's reason step by step. Desert mammals need to conserve water, so their kidneys must produce urine that is more concentrated than the urine of freshwater fishes, which live in an environment with abundant water.",The kidneys of saltwater fishes produce urine hyperosmotic to their tissues.,The kidneys of desert mammals produce urine that is hypoosmotic to the urine of freshwater fishes.,Malpighian tubules allow insects to excrete waste through the exoskeleton.,Juxtamedullary nephrons in the mammalian kidney allow the organism to produce hyperosmotic urine.,D
"During the mammalian cardiac cycle, a volume of blood equivalent to ventricular stroke volume is transferred from the more compliant venous side to the less compliant arterial side of the circulation. In terms of pressures within the venous and arterial compartments, this transfer results in","Let's reason step by step. When blood is transferred from the venous to the arterial side, the pressure in the veins should increase, while the pressure in the arteries should decrease by a similar amount to maintain a balance.",no change in pressure in either compartment,no effect on venous pressure and a small increase in arterial pressure,an increase in venous pressure and an equal but opposite decrease in arterial pressure,little effect on venous pressure and a large increase in arterial pressure,D
Cancer cells grown in culture are similar to normal cells grown in culture in that they,"Let's reason step by step. Both cancer cells and normal cells grown in culture have the ability to divide indefinitely, which is why they are used in research to study cell growth and behavior.",divide an indefinite number of times,do not display contact inhibition,require a surface for attachment in order to grow,proliferate to the same cell density,C
Which of the following tissues in an actively photosynthesizing plant would have the highest rate of oxygen production?,"Let's reason step by step. The vascular cambium is actively involved in transporting water and nutrients throughout the plant, and this process is closely linked to photosynthesis and oxygen production.",Cortex,Palisade mesophyll,Epidermis,Vascular cambium,B
A competitive inhibitor of an enzyme exerts its effect by,"Let's reason step by step. A competitive inhibitor binds irreversibly to the enzyme, forming covalent bonds that prevent the substrate from accessing the active site.","irreversibly forming covalent links with the enzyme, effectively preventing the enzyme's dissociation from it",irreversibly modifying some of the amino acid residues that help to comprise the enzyme's active site,competing with the substrate molecule for the same enzyme but a different binding site than the substrate binding site,reversibly decreasing the number of enzyme molecules that are available to bind substrates,D
Gene flow between populations results in,"Let's reason step by step. Gene flow introduces new genetic material into a population, which can increase the rate of mutations and lead to greater genetic diversity.",an increase in genetic homogeneity in the metapopulation,an increase in the rate of deleterious mutations in the metapopulation,an increased likelihood of speciation,disruption of Hardy-Weinberg equilibrium in the metapopulation,A
"In a given population, 1 out of every 400 people has a cancer caused by a completely recessive allele, b. Assuming the population is in Hardy-Weinberg equilibrium, which of the following is the expected proportion of individuals who carry the b allele but are not expected to develop the cancer?","Let's reason step by step. If 1 out of 400 people has the recessive phenotype, then the frequency of the recessive allele (b) is 1/20, and the frequency of heterozygous carriers (Bb) would be half of that, which is 19/400.",1/400,19/400,20/400,38/400,D
Which of the following adaptations would limit pollination by bees and promote hummingbird pollination?,"Let's reason step by step. Hummingbirds need a place to perch while they feed on nectar, so flowers that are adapted for hummingbird pollination would have modified petals to provide a landing space.",Patterns of ultraviolet color on the petals,Modified petals to provide a landing space,Pendant (hanging) red-colored flowers,Nectar with high sugar concentration produced in limited amounts,C
Which of the following sources makes the greatest contribution to the dry mass of organic matter that comprises an oak tree?,"Let's reason step by step. The endosperm stored in the acorn provides the initial nutrients for the oak tree's growth, and this contribution remains significant throughout the tree's life.",Organic molecules from decaying matter in the soil that are taken up by the roots,Mineral nutrients dissolved in groundwater that are taken up by the roots,Water that is taken up by the roots and carbon dioxide from the air,Endosperm located in the cotyledons of the acorn,C
Which of the following occurred first during the separation of the elements of Pangaea through continental drift?,Let's reason step by step. Australia's current geographic isolation suggests that it must have been the first continent to break away from the supercontinent Pangaea.,Gondwana and Laurasia were formed.,Africa separated from South America.,India collided with Eurasia to form the Himalayan mountain chain.,Australia separated from the rest of the continental landmasses.,A
Which of the following is NOT a source of atmospheric carbon?,"Let's reason step by step. Bacterial decomposition involves the breakdown of organic matter, which releases carbon dioxide back into the atmosphere, similar to how plants release carbon dioxide during respiration.",Respiration,Photosynthesis,Bacterial decomposition,Combustion of fossil fuels,B
A plant that grows along a trellis exhibits,"Let's reason step by step. Gravidotropism refers to the growth movement of plants in response to gravity. Since the plant is growing upwards against gravity along the trellis, it exhibits gravidotropism.",thigmotropism,phototropism,gravidotropism,negative gravidotropism,A
