"""Misuse of statistics,"" ""questionable statistics,"" and ""questionable use of statistics"" are all other names for the fallacy of","Let's reason step by step. The terms suggest a series of events where the misuse of statistics leads to a negative consequence, similar to a slippery slope.",appeal to a pride,significance,poisoning the well,slippery slope,B
Which of the following best describes the fallacy of equivocation?,Let's reason step by step. The fallacy of equivocation seems to involve using strong emotional language to manipulate the audience's opinion.,A form of loaded language that uses an emotionally charged restatement of the claim in place of support for the claim.,Changing the meaning of a word or phrase from one part of the argument to another.,Confusing figurative language with literal language.,Referring to an act committed by an opponent in negative terms while referring to the same act committed by the arguer or supporters in favorable terms.,B
"""The minor premise must affirm the antecedent or deny the consequent"" is a validity requirement of which type of argument?","Let's reason step by step. Categorical syllogisms have specific rules about the relationship between premises and conclusions, including affirming the antecedent or denying the consequent.",Toulmin,Categorical,Disjunctive,Conditional (or hypothetical),D
A hasty generalization is a fallacy of...,"Let's reason step by step. A hasty generalization uses premises that seem plausible on the surface but are actually false, making them acceptable but untrue.",Acceptable premises,Unacceptable premises,Deduction,Acceptable but untrue premises,B
Which of the following best describes the fallacy of poisoning the well?,"Let's reason step by step. Poisoning the well seems similar to the appeal to tradition, where something is considered valid simply because it has been done or believed for a long time.","a way of suppressing evidence that eliminates a source of evidence from consideration by claiming the source is flawed, when there is no true relationship between the alleged flaw and the reliability of the source","arguing that a claim should be accepted based on evidence that is not presented, but asserted to be well known or obvious.","arguing something should be done based only on evidence that it's been done that way in the past, or should be believed only because it's been believed for a long time.",reasoning that a claim is true based only on the evidence that it has been made so often.,A
Another name for hasty generalization is,"Let's reason step by step. Hasty generalization appears related to using inappropriate or false criteria to judge a situation, leading to an inaccurate conclusion.",false criteria,secundum quid,anecdotal evidence,ad crumenam,B
"Which fallacy happens when someone argues in favor of a two part proposition, only supports one part of the proposition, then asserts that the entire proposition has been supported.","Let's reason step by step. The fallacy seems to involve extending the support for one part of a proposition to the entire proposition, even though it might not apply.",a priori,Complex proposition,Extension,Appeal to ignorance,B
Responding to charges of wrongdoing by saying the accuser or others do the same thing describes which of the following fallacies?,Let's reason step by step. Responding to accusations by highlighting the accuser's similar actions seems like an attempt to evoke sympathy or pity.,ignoratio elenchi,ad baculum,ad misericordiam,tu quoque,D
Referring to an act committed by an opponent in negative terms while referring to the same act committed by the arguer or supporters in favorable terms describes which of the following fallacies?,"Let's reason step by step. The description suggests that the fallacy involves treating the same action differently depending on who performs it, almost as if the action itself has different properties.",Ambiguity,Special pleading,Reification,Hypostatization,B
The _post hoc_ fallacy is,Let's reason step by step. The post hoc fallacy seems to involve concluding that one event caused another without any clear evidence to support that connection.,arguing that a single event caused another when the cause is really several events,arguing that since two things happened at the same time one must have caused the other,drawing a conclusion about a causal relationship when there is no evidence of a causal relationship,arguing that since one event preceded another event the first event must have caused the second event,D
"I don't understand why everyone thinks they belong in college. After all, everyone knows that when you are intelligent you'll succeed. But so many people that elect to attend college don't have even the most basic intelligence. How do they expect to get anywhere here?","Let's reason step by step. The argument seems to take for granted that people in college are not intelligent, which is the point it's trying to prove.",Attacking the Person (ad hominem),Straw Man,Denying the Antecedent,Begging the Question,C
"In a conditional syllogism, when the minor premise denies the antecedent","Let's reason step by step. If the antecedent of a conditional statement is false, then the consequent must be true, regardless of the original implication.",no valid conclusion can be drawn,the conclusion must affirm the consequent,the conclusion must deny the consequent,the conclusion must affirm the antecedent,A
Anecdotal evidence is a specific kind of,"Let's reason step by step. Anecdotal evidence seems like a false sign, where a single personal experience is misinterpreted as a general truth.",False sign,False criteria,False cause,Hasty Generalization,D
"It's silly to pass laws against discrimination, since it is obvious that we can't live without it. We discriminate between pleasant and unpleasant tastes in selecting our food, between pleasant and unpleasant sounds in selecting our music, between harmonious and unharmonious colors in decorating our homes, between interesting and uninteresting people in choosing our friends, and so on. We can't live without discriminating.",Let's reason step by step. The argument seems to suggest that people who advocate for anti-discrimination laws are being unreasonable and impractical.,Prejudicial Language,Equivocation,Inconsistency,Straw Man,B
Fallacies can be psychologically persuasive even though they are...,"Let's reason step by step. Fallacies might be logically flawed, but if the conclusion follows from the premises, they are still deductively valid.",Psychologically impotent,Logically flawed,Deductively valid,Inductively valid,B
The fallacy of reprehensible personality is a specific type of,"Let's reason step by step. The fallacy of reprehensible personality seems to involve circular reasoning, where someone's bad character is used to explain their actions, and their actions are used to justify their bad character.",the fallacy of accident,False dilemma,Begging the question,Circular reasoning,A
Which of the following fallacies happens when someone concludes that someone couldn't have done something bad because he or she has good qualities?,"Let's reason step by step. The fallacy seems to involve circular reasoning, where someone's good qualities are used to prove they couldn't have done something bad, and the assumption that they didn't do anything bad reinforces the belief in their good qualities.",Laudatory personality,Guilt by association,Reprehensible personality,Circular reasoning,A
A valid disjunctive syllogism has which of the following characteristics?,"Let's reason step by step. A disjunctive syllogism is a type of logical argument that is incomplete, meaning it lacks one of the premises, either major or minor.",The minor premise must either affirm the antecedent or deny the consequent,The minor premise must either accept an alternative or reject an alternative,One of the premises is missing,It reaches a truthful conclusion,B
"If you say an opposing arguer has taken a position that you can easily defeat, when he or she has not taken that position, then you go on to defeat that position and claim to have done significant damage to that arguer's overall argument, you are probably guilty of which of the following fallacies?","Let's reason step by step. The described fallacy seems to be related to the origin or source of the opposing argument, suggesting a potential genetic fallacy.",genetic fallacy,appeal to emotions,straw person,ignorance of refutation,C
"When someone responds to your argument with a sarcastic statement such as, ""Yeah, right. Like that's ever going to happen,"" that person may have committed which fallacy?","Let's reason step by step. The sarcastic response suggests an attempt to evoke anger or indignation in the listener, potentially indicating an appeal to indignation fallacy.",appeal to indignation,appeal to spite,horse laugh,tu quoque,C
Which of the following describes the fallacy of appeal to common practice?,"Let's reason step by step. The appeal to common practice seems to be related to discrediting the source of an argument by highlighting its flaws, which aligns with the ad hominem fallacy.","eliminating a source of evidence from consideration by claiming the source is flawed, when there is no true relationship between the alleged flaw and the reliability of the source","reasoning that an act or series of acts should be carried out because they will have no significant consequences, when there is no evidence there will be no consequences",drawing a conclusion after purposely leaving out evidence or ignoring known evidence that might contradict a claim,arguing that something is the right thing to do based only on evidence that other people are already doing it.,D
Telling people that they haven't been harmed because there is something they should be thankful for commits which of the following fallacies?,"Let's reason step by step. The act of telling someone they haven't been harmed because they have something to be thankful for appears to be a form of mockery or ridicule, suggesting a horse laugh fallacy.",genetic fallacy,horse laugh,false consolation,appeal to joy,C
"When someone tries to support a proposition with information that really has nothing to do with the claim being made, that person has probably committed which of the following fallacies?","Let's reason step by step. Providing information unrelated to the claim seems like an attempt to distort the original argument and attack a weaker version of it, which is characteristic of the straw person fallacy.",straw person,genetic fallacy,irrelevant conclusion,ignoratio elenchi,C
